{
  "$schema": "http://json-schema.org/draft-07/schema#",
  "title": "CSA S157-17 Aluminium Member Design",
  "description": "Design aluminium members in accordance with CSA S157-17.",
  "type": "object",
  "properties": {
    "standard": {
      "type": "string",
      "description": "Standard. Symbol: Standard. Standard used for calculations.",
      "enum": [
        "CSA S157"
      ],
      "x-enumLabels": [
        "CSA S157"
      ],
      "default": "CSA S157"
    },
    "alloy_input": {
      "type": "string",
      "description": "Alloy. Symbol: Alloy. Aluminium alloy.",
      "enum": [
        "1060-H12_drawn tube",
        "1060-H12_sheet and plate",
        "1060-H14_drawn tube",
        "1060-H14_sheet and plate",
        "1100-H12_drawn tube",
        "1100-H12_sheet and plate",
        "1100-H14_drawn tube",
        "1100-H14_sheet and plate",
        "2014-T6_bar, rod and wire",
        "2014-T6_drawn tube",
        "2014-T6_extrusion",
        "2014-T6_sheet and plate (thick)",
        "2014-T6_sheet and plate (thin)",
        "2014-T651_bar, rod and wire",
        "2014-T651_sheet and plate",
        "2014-T6510_extrusion",
        "2014-T6511_extrusion",
        "2219-T87_sheet and plate",
        "3003-H12_drawn tube",
        "3003-H12_sheet and plate",
        "3003-H14_drawn tube",
        "3003-H14_sheet and plate",
        "3003-H16_drawn tube",
        "3003-H16_sheet and plate",
        "3003-H18_drawn tube",
        "3003-H18_sheet and plate",
        "3004-H32_sheet and plate",
        "3004-H34_sheet and plate",
        "3004-H36_sheet and plate",
        "3004-H38_sheet and plate",
        "3005-H25_sheet and plate",
        "3005-H28_sheet and plate",
        "3105-H25_sheet and plate",
        "5005-H12_sheet and plate",
        "5005-H14_sheet and plate",
        "5005-H16_sheet and plate",
        "5005-H32_sheet and plate",
        "5005-H34_sheet and plate",
        "5005-H36_sheet and plate",
        "5050-H32_drawn tube",
        "5050-H32_sheet and plate",
        "5050-H34_drawn tube",
        "5050-H34_sheet and plate",
        "5050-H36_sheet and plate",
        "5052-H32_drawn tube",
        "5052-H32_sheet and plate",
        "5052-H34_drawn tube",
        "5052-H34_sheet and plate",
        "5052-H36_sheet and plate",
        "5052-O_sheet and plate",
        "5083-H111_extrusion",
        "5083-H111_forging",
        "5083-H112_extrusion",
        "5083-H116_sheet and plate (thick)",
        "5083-H116_sheet and plate (thin)",
        "5083-H32_sheet and plate (thick)",
        "5083-H32_sheet and plate (thin)",
        "5083-H321_sheet and plate (thick)",
        "5083-H321_sheet and plate (thin)",
        "5083-O_extrusion",
        "5083-O_sheet and plate",
        "5086-H111_extrusion",
        "5086-H112_extrusion",
        "5086-H112_sheet and plate (regular)",
        "5086-H112_sheet and plate (thick)",
        "5086-H112_sheet and plate (thin)",
        "5086-H116_sheet and plate",
        "5086-H32_drawn tube",
        "5086-H32_sheet and plate",
        "5086-H321_sheet and plate",
        "5086-H34_drawn tube",
        "5086-H34_sheet and plate",
        "5086-O_extrusion",
        "5086-O_sheet and plate",
        "5154-H38_sheet and plate",
        "5454-H111_extrusion",
        "5454-H112_extrusion",
        "5454-H32_sheet and plate",
        "5454-H34_sheet and plate",
        "5454-O_extrusion",
        "5454-O_sheet and plate",
        "5456-H116_sheet and plate (regular)",
        "5456-H116_sheet and plate (thick)",
        "5456-H116_sheet and plate (thin)",
        "5456-H32_sheet and plate (regular)",
        "5456-H32_sheet and plate (thick)",
        "5456-H32_sheet and plate (thin)",
        "5456-H321_sheet and plate (regular)",
        "5456-H321_sheet and plate (thick)",
        "5456-H321_sheet and plate (thin)",
        "5456-O_sheet and plate",
        "6005A-T61_extrusion",
        "6005-T5_extrusion",
        "6061-T6_B241 pipe and tube",
        "6061-T6_B429 pipe and tube",
        "6061-T6_bar, rod and wire",
        "6061-T6_drawn tube",
        "6061-T6_extrusion",
        "6061-T6_forging",
        "6061-T6_sheet and plate",
        "6061-T6_std structural profile",
        "6061-T6_tread plate",
        "6061-T651_bar, rod and wire",
        "6061-T651_sheet and plate",
        "6061-T6510_B241 pipe and tube",
        "6061-T6510_B429 pipe and tube",
        "6061-T6510_extrusion",
        "6061-T6511_B241 pipe and tube",
        "6061-T6511_B429 pipe and tube",
        "6061-T6511_extrusion",
        "6063-T5_extrusion (regular)",
        "6063-T5_extrusion (thin)",
        "6063-T52_extrusion",
        "6063-T6_B241 pipe and tube",
        "6063-T6_B429 pipe and tube",
        "6063-T6_extrusion",
        "6066-T6_extrusion",
        "6066-T6510_extrusion",
        "6066-T6511_extrusion",
        "6070-T6_extrusion",
        "6082-T6_extrusion",
        "6082-T6511_extrusion",
        "6105-T5_extrusion",
        "6351-T5_extrusion",
        "6351-T6_extrusion",
        "6463-T6_extrusion",
        "7005-T53_extrusion",
        "Alclad 2014-T6_sheet and plate (thick)",
        "Alclad 2014-T6_sheet and plate (thin)",
        "Alclad 2014-T651_sheet and plate",
        "Alclad 3003-H12_sheet and plate",
        "Alclad 3003-H14_drawn tube",
        "Alclad 3003-H14_sheet and plate",
        "Alclad 3003-H16_sheet and plate",
        "Alclad 3003-H18_drawn tube",
        "Alclad 3004-H32_sheet and plate",
        "Alclad 3004-H34_sheet and plate",
        "Alclad 3004-H36_sheet and plate"
      ],
      "x-enumLabels": [
        "1060-H12_drawn tube",
        "1060-H12_sheet and plate",
        "1060-H14_drawn tube",
        "1060-H14_sheet and plate",
        "1100-H12_drawn tube",
        "1100-H12_sheet and plate",
        "1100-H14_drawn tube",
        "1100-H14_sheet and plate",
        "2014-T6_bar, rod and wire",
        "2014-T6_drawn tube",
        "2014-T6_extrusion",
        "2014-T6_sheet and plate (thick)",
        "2014-T6_sheet and plate (thin)",
        "2014-T651_bar, rod and wire",
        "2014-T651_sheet and plate",
        "2014-T6510_extrusion",
        "2014-T6511_extrusion",
        "2219-T87_sheet and plate",
        "3003-H12_drawn tube",
        "3003-H12_sheet and plate",
        "3003-H14_drawn tube",
        "3003-H14_sheet and plate",
        "3003-H16_drawn tube",
        "3003-H16_sheet and plate",
        "3003-H18_drawn tube",
        "3003-H18_sheet and plate",
        "3004-H32_sheet and plate",
        "3004-H34_sheet and plate",
        "3004-H36_sheet and plate",
        "3004-H38_sheet and plate",
        "3005-H25_sheet and plate",
        "3005-H28_sheet and plate",
        "3105-H25_sheet and plate",
        "5005-H12_sheet and plate",
        "5005-H14_sheet and plate",
        "5005-H16_sheet and plate",
        "5005-H32_sheet and plate",
        "5005-H34_sheet and plate",
        "5005-H36_sheet and plate",
        "5050-H32_drawn tube",
        "5050-H32_sheet and plate",
        "5050-H34_drawn tube",
        "5050-H34_sheet and plate",
        "5050-H36_sheet and plate",
        "5052-H32_drawn tube",
        "5052-H32_sheet and plate",
        "5052-H34_drawn tube",
        "5052-H34_sheet and plate",
        "5052-H36_sheet and plate",
        "5052-O_sheet and plate",
        "5083-H111_extrusion",
        "5083-H111_forging",
        "5083-H112_extrusion",
        "5083-H116_sheet and plate (thick)",
        "5083-H116_sheet and plate (thin)",
        "5083-H32_sheet and plate (thick)",
        "5083-H32_sheet and plate (thin)",
        "5083-H321_sheet and plate (thick)",
        "5083-H321_sheet and plate (thin)",
        "5083-O_extrusion",
        "5083-O_sheet and plate",
        "5086-H111_extrusion",
        "5086-H112_extrusion",
        "5086-H112_sheet and plate (regular)",
        "5086-H112_sheet and plate (thick)",
        "5086-H112_sheet and plate (thin)",
        "5086-H116_sheet and plate",
        "5086-H32_drawn tube",
        "5086-H32_sheet and plate",
        "5086-H321_sheet and plate",
        "5086-H34_drawn tube",
        "5086-H34_sheet and plate",
        "5086-O_extrusion",
        "5086-O_sheet and plate",
        "5154-H38_sheet and plate",
        "5454-H111_extrusion",
        "5454-H112_extrusion",
        "5454-H32_sheet and plate",
        "5454-H34_sheet and plate",
        "5454-O_extrusion",
        "5454-O_sheet and plate",
        "5456-H116_sheet and plate (regular)",
        "5456-H116_sheet and plate (thick)",
        "5456-H116_sheet and plate (thin)",
        "5456-H32_sheet and plate (regular)",
        "5456-H32_sheet and plate (thick)",
        "5456-H32_sheet and plate (thin)",
        "5456-H321_sheet and plate (regular)",
        "5456-H321_sheet and plate (thick)",
        "5456-H321_sheet and plate (thin)",
        "5456-O_sheet and plate",
        "6005A-T61_extrusion",
        "6005-T5_extrusion",
        "6061-T6_B241 pipe and tube",
        "6061-T6_B429 pipe and tube",
        "6061-T6_bar, rod and wire",
        "6061-T6_drawn tube",
        "6061-T6_extrusion",
        "6061-T6_forging",
        "6061-T6_sheet and plate",
        "6061-T6_std structural profile",
        "6061-T6_tread plate",
        "6061-T651_bar, rod and wire",
        "6061-T651_sheet and plate",
        "6061-T6510_B241 pipe and tube",
        "6061-T6510_B429 pipe and tube",
        "6061-T6510_extrusion",
        "6061-T6511_B241 pipe and tube",
        "6061-T6511_B429 pipe and tube",
        "6061-T6511_extrusion",
        "6063-T5_extrusion (regular)",
        "6063-T5_extrusion (thin)",
        "6063-T52_extrusion",
        "6063-T6_B241 pipe and tube",
        "6063-T6_B429 pipe and tube",
        "6063-T6_extrusion",
        "6066-T6_extrusion",
        "6066-T6510_extrusion",
        "6066-T6511_extrusion",
        "6070-T6_extrusion",
        "6082-T6_extrusion",
        "6082-T6511_extrusion",
        "6105-T5_extrusion",
        "6351-T5_extrusion",
        "6351-T6_extrusion",
        "6463-T6_extrusion",
        "7005-T53_extrusion",
        "Alclad 2014-T6_sheet and plate (thick)",
        "Alclad 2014-T6_sheet and plate (thin)",
        "Alclad 2014-T651_sheet and plate",
        "Alclad 3003-H12_sheet and plate",
        "Alclad 3003-H14_drawn tube",
        "Alclad 3003-H14_sheet and plate",
        "Alclad 3003-H16_sheet and plate",
        "Alclad 3003-H18_drawn tube",
        "Alclad 3004-H32_sheet and plate",
        "Alclad 3004-H34_sheet and plate",
        "Alclad 3004-H36_sheet and plate"
      ],
      "default": "6061-T6_extrusion"
    },
    "shape_input": {
      "type": "string",
      "description": "Shape. Symbol: Shape. Section Shape.",
      "enum": [
        "Rectangular Tube",
        "Circular Tube",
        "I-Beam",
        "Channel"
      ],
      "x-enumLabels": [
        "Rectangular Tube",
        "Circular Tube",
        "I-Beam",
        "Channel"
      ],
      "default": "Rectangular Tube"
    },
    "b_input": {
      "type": "number",
      "description": "b. Symbol: b. Units: mm. Section width.",
      "default": 150,
      "minimum": 10,
      "maximum": 500
    },
    "d_input": {
      "type": "number",
      "description": "d. Symbol: d. Units: mm. Section height.",
      "default": 300,
      "minimum": 10,
      "maximum": 500
    },
    "t_f_input": {
      "type": "number",
      "description": "tf. Symbol: t_f. Units: mm. Flange thickness.",
      "default": 5,
      "minimum": 1,
      "maximum": 25
    },
    "t_w_input": {
      "type": "number",
      "description": "tw. Symbol: t_w. Units: mm. Web thickness.",
      "default": 5,
      "minimum": 1,
      "maximum": 25
    },
    "t_input": {
      "type": "number",
      "description": "t. Symbol: t. Units: mm. Section thickness.",
      "default": 5,
      "minimum": 1,
      "maximum": 25
    },
    "KL_z_input": {
      "type": "number",
      "description": "KLz. Symbol: KL_{z}. Units: mm. Unbraced length about the Z Axis. ",
      "default": 5000,
      "minimum": 1,
      "maximum": 1000000
    },
    "KL_y_input": {
      "type": "number",
      "description": "KLy. Symbol: KL_{y}. Units: mm. Unbraced length about the Y Axis. ",
      "default": 2000,
      "minimum": 1,
      "maximum": 1000000
    },
    "KL_t_input": {
      "type": "number",
      "description": "KLt. Symbol: KL_{t}. Units: mm. Unbraced torsional length.",
      "default": 2000,
      "minimum": 1,
      "maximum": 1000000
    },
    "M_fz_input": {
      "type": "number",
      "description": "Mfz. Symbol: M_{fz}. Units: kN*m. Major Axis Factored moment (About the Z-Axis).",
      "default": 3,
      "minimum": -5000,
      "maximum": 5000
    },
    "M_fy_input": {
      "type": "number",
      "description": "Mfy. Symbol: M_{fy}. Units: kN*m. Minor Axis Factored Moment (About the Y-Axis).",
      "default": 4,
      "minimum": -5000,
      "maximum": 5000
    },
    "V_fy_input": {
      "type": "number",
      "description": "Vfy. Symbol: V_{fy}. Units: kN. Major Axis Factored Shear (Y direction).",
      "default": 7.5,
      "minimum": -10000,
      "maximum": 10000
    },
    "V_fz_input": {
      "type": "number",
      "description": "Vfz. Symbol: V_{fz}. Units: kN. Minor Axis Factored Shear (Z direction).",
      "default": 0,
      "minimum": -10000,
      "maximum": 10000
    },
    "P_f_input": {
      "type": "number",
      "description": "Pf. Symbol: P_{f}. Units: kN. Factored Axial Load (X direction, Tension negative).",
      "default": 0,
      "minimum": -10000,
      "maximum": 10000
    },
    "lower_omega_input": {
      "type": "number",
      "description": "ω. Symbol: ω. Moment gradient coefficient",
      "default": 1,
      "minimum": 1,
      "maximum": 2.5
    },
    "upper_omega_input": {
      "type": "number",
      "description": "Ω. Symbol: Ω. Load Application Factor",
      "default": 1.4,
      "minimum": 0.7,
      "maximum": 1.4
    },
    "analysis_results": {
      "type": "string",
      "description": "analysis_results"
    },
    "uid": {
      "type": "string",
      "const": "2603-csa-aluminium-design",
      "description": "Calculator unique identifier — must match the endpoint uid."
    },
    "current_unit_system": {
      "type": "string",
      "enum": [
        "metric",
        "imperial",
        ""
      ],
      "default": "metric",
      "description": "Unit system for input values and output display."
    },
    "project_details": {
      "type": "object",
      "description": "Optional project metadata for the PDF report header.",
      "properties": {
        "project_company": {
          "type": "string",
          "default": ""
        },
        "project_name": {
          "type": "string",
          "default": ""
        },
        "project_designer": {
          "type": "string",
          "default": ""
        },
        "project_id": {
          "type": "string",
          "default": ""
        },
        "project_client": {
          "type": "string",
          "default": ""
        },
        "project_notes": {
          "type": "string",
          "default": ""
        }
      }
    }
  }
}